[
	{
		"name": "Bee",
		"tier_info": {
			"tier": 1,
			"url": "https://sapi.com/api/v1/tokens?tier=1"
		},
		"sprites": {
			"standard": "https://raw.githubusercontent.com/apacha01/assets/sap/super-auto-pets/tokens/standard/Bee.png",
			"classic": "https://raw.githubusercontent.com/apacha01/assets/sap/super-auto-pets/tokens/classic/Bee_Classic.png"
		},
		"abilities": {
			"lv1_ability": "",
			"lv2_ability": "",
			"lv3_ability": ""
		},
		"summoned_from": {
			"source": "Any Pet with Honey Perk once it faints.",
			"url": "https://sapi.com/api/v1/foods/honey"
		},
		"stats": {
			"lv1_stats": [
				{
					"name": "hp",
					"base_stat": 1,
					"url": "https://sapi.com/api/v1/stats/hp"
				},
				{
					"name": "attack",
					"base_stat": 1,
					"url": "https://sapi.com/api/v1/stats/atk"
				}
			],
			"lv2_stats": [
				{
					"name": "hp",
					"base_stat": 1,
					"url": "https://sapi.com/api/v1/stats/hp"
				},
				{
					"name": "attack",
					"base_stat": 1,
					"url": "https://sapi.com/api/v1/stats/atk"
				}
			],
			"lv3_stats": [
				{
					"name": "hp",
					"base_stat": 1,
					"url": "https://sapi.com/api/v1/stats/hp"
				},
				{
					"name": "attack",
					"base_stat": 1,
					"url": "https://sapi.com/api/v1/stats/atk"
				}
			]
		},
		"notes": ""
	},
	{
		"name": "Chick",
		"tier_info": {
			"tier": 1,
			"url": "https://sapi.com/api/v1/tokens?tier=1"
		},
		"sprites": {
			"standard": "https://raw.githubusercontent.com/apacha01/assets/sap/super-auto-pets/tokens/standard/Chick.png",
			"classic": "https://raw.githubusercontent.com/apacha01/assets/sap/super-auto-pets/tokens/classic/Chick_Classic.png"
		},
		"abilities": {
			"lv1_ability": "",
			"lv2_ability": "",
			"lv3_ability": ""
		},
		"summoned_from": {
			"source": "A Rooster once it faints.",
			"url": "https://sapi.com/api/v1/pets/rooster"
		},
		"stats": {
			"lv1_stats": [
				{
					"name": "hp",
					"base_stat": 1,
					"url": "https://sapi.com/api/v1/stats/hp"
				},
				{
					"name": "attack",
					"base_stat": 0,
					"url": "https://sapi.com/api/v1/stats/atk"
				}
			],
			"lv2_stats": [
				{
					"name": "hp",
					"base_stat": 1,
					"url": "https://sapi.com/api/v1/stats/hp"
				},
				{
					"name": "attack",
					"base_stat": 0,
					"url": "https://sapi.com/api/v1/stats/atk"
				}
			],
			"lv3_stats": [
				{
					"name": "hp",
					"base_stat": 1,
					"url": "https://sapi.com/api/v1/stats/hp"
				},
				{
					"name": "attack",
					"base_stat": 0,
					"url": "https://sapi.com/api/v1/stats/atk"
				}
			]
		},
		"notes": "Stats on 0 are replaceable for half of the Rooster's attack."
	},
	{
		"name": "Loyal_Chinchilla",
		"tier_info": {
			"tier": 1,
			"url": "https://sapi.com/api/v1/tokens?tier=1"
		},
		"sprites": {
			"standard": "https://raw.githubusercontent.com/apacha01/assets/sap/super-auto-pets/tokens/standard/Loyal_Chinchilla.png",
			"classic": "https://raw.githubusercontent.com/apacha01/assets/sap/super-auto-pets/tokens/classic/Loyal_Chinchilla_Classic.png"
		},
		"abilities": {
			"lv1_ability": "",
			"lv2_ability": "",
			"lv3_ability": ""
		},
		"summoned_from": {
			"source": "A Chinchilla upon being sold.",
			"url": "https://sapi.com/api/v1/pets/chinchilla"
		},
		"stats": {
			"lv1_stats": [
				{
					"name": "hp",
					"base_stat": 2,
					"url": "https://sapi.com/api/v1/stats/hp"
				},
				{
					"name": "attack",
					"base_stat": 2,
					"url": "https://sapi.com/api/v1/stats/atk"
				}
			],
			"lv2_stats": [
				{
					"name": "hp",
					"base_stat": 4,
					"url": "https://sapi.com/api/v1/stats/hp"
				},
				{
					"name": "attack",
					"base_stat": 4,
					"url": "https://sapi.com/api/v1/stats/atk"
				}
			],
			"lv3_stats": [
				{
					"name": "hp",
					"base_stat": 6,
					"url": "https://sapi.com/api/v1/stats/hp"
				},
				{
					"name": "attack",
					"base_stat": 6,
					"url": "https://sapi.com/api/v1/stats/atk"
				}
			]
		},
		"notes": ""
	},
	{
		"name": "Zombie_Cricket",
		"tier_info": {
			"tier": 1,
			"url": "https://sapi.com/api/v1/tokens?tier=1"
		},
		"sprites": {
			"standard": "https://raw.githubusercontent.com/apacha01/assets/sap/super-auto-pets/tokens/standard/Zombie_Cricket.png",
			"classic": "https://raw.githubusercontent.com/apacha01/assets/sap/super-auto-pets/tokens/classic/Zombie_Cricket_Classic.png"
		},
		"abilities": {
			"lv1_ability": "",
			"lv2_ability": "",
			"lv3_ability": ""
		},
		"summoned_from": {
			"source": "A Cricket once it faints.",
			"url": "https://sapi.com/api/v1/pets/cricket"
		},
		"stats": {
			"lv1_stats": [
				{
					"name": "hp",
					"base_stat": 1,
					"url": "https://sapi.com/api/v1/stats/hp"
				},
				{
					"name": "attack",
					"base_stat": 1,
					"url": "https://sapi.com/api/v1/stats/atk"
				}
			],
			"lv2_stats": [
				{
					"name": "hp",
					"base_stat": 2,
					"url": "https://sapi.com/api/v1/stats/hp"
				},
				{
					"name": "attack",
					"base_stat": 2,
					"url": "https://sapi.com/api/v1/stats/atk"
				}
			],
			"lv3_stats": [
				{
					"name": "hp",
					"base_stat": 3,
					"url": "https://sapi.com/api/v1/stats/hp"
				},
				{
					"name": "attack",
					"base_stat": 3,
					"url": "https://sapi.com/api/v1/stats/atk"
				}
			]
		},
		"notes": ""
	},
	{
		"name": "Dirty_Rat",
		"tier_info": {
			"tier": 1,
			"url": "https://sapi.com/api/v1/tokens?tier=1"
		},
		"sprites": {
			"standard": "https://raw.githubusercontent.com/apacha01/assets/sap/super-auto-pets/tokens/standard/Dirty_Rat.png",
			"classic": "https://raw.githubusercontent.com/apacha01/assets/sap/super-auto-pets/tokens/classic/Dirty_Rat_Classic.png"
		},
		"abilities": {
			"lv1_ability": "",
			"lv2_ability": "",
			"lv3_ability": ""
		},
		"summoned_from": {
			"source": "A Rat once it faints.",
			"url": "https://sapi.com/api/v1/pets/rat"
		},
		"stats": {
			"lv1_stats": [
				{
					"name": "hp",
					"base_stat": 1,
					"url": "https://sapi.com/api/v1/stats/hp"
				},
				{
					"name": "attack",
					"base_stat": 1,
					"url": "https://sapi.com/api/v1/stats/atk"
				}
			],
			"lv2_stats": [
				{
					"name": "hp",
					"base_stat": 1,
					"url": "https://sapi.com/api/v1/stats/hp"
				},
				{
					"name": "attack",
					"base_stat": 1,
					"url": "https://sapi.com/api/v1/stats/atk"
				}
			],
			"lv3_stats": [
				{
					"name": "hp",
					"base_stat": 1,
					"url": "https://sapi.com/api/v1/stats/hp"
				},
				{
					"name": "attack",
					"base_stat": 1,
					"url": "https://sapi.com/api/v1/stats/atk"
				}
			]
		},
		"notes": ""
	},
	{
		"name": "Lizard_Tail",
		"tier_info": {
			"tier": 1,
			"url": "https://sapi.com/api/v1/tokens?tier=1"
		},
		"sprites": {
			"standard": "https://raw.githubusercontent.com/apacha01/assets/sap/super-auto-pets/tokens/standard/Lizard_Tail.png",
			"classic": "https://raw.githubusercontent.com/apacha01/assets/sap/super-auto-pets/tokens/standard/Lizard_Tail.png"
		},
		"abilities": {
			"lv1_ability": "",
			"lv2_ability": "",
			"lv3_ability": ""
		},
		"summoned_from": {
			"source": "A Lizard when it is Hurt.",
			"url": "https://sapi.com/api/v1/pets/lizard"
		},
		"stats": {
			"lv1_stats": [
				{
					"name": "hp",
					"base_stat": 1,
					"url": "https://sapi.com/api/v1/stats/hp"
				},
				{
					"name": "attack",
					"base_stat": 3,
					"url": "https://sapi.com/api/v1/stats/atk"
				}
			],
			"lv2_stats": [
				{
					"name": "hp",
					"base_stat": 2,
					"url": "https://sapi.com/api/v1/stats/hp"
				},
				{
					"name": "attack",
					"base_stat": 6,
					"url": "https://sapi.com/api/v1/stats/atk"
				}
			],
			"lv3_stats": [
				{
					"name": "hp",
					"base_stat": 3,
					"url": "https://sapi.com/api/v1/stats/hp"
				},
				{
					"name": "attack",
					"base_stat": 9,
					"url": "https://sapi.com/api/v1/stats/atk"
				}
			]
		},
		"notes": "https://sapi.com/api/v1/pets/lizard"
	},
	{
		"name": "Nest",
		"tier_info": {
			"tier": 1,
			"url": "https://sapi.com/api/v1/tokens?tier=1"
		},
		"sprites": {
			"standard": "https://raw.githubusercontent.com/apacha01/assets/sap/super-auto-pets/tokens/standard/Nest.png",
			"classic": "https://raw.githubusercontent.com/apacha01/assets/sap/super-auto-pets/tokens/standard/Nest.png"
		},
		"abilities": {
			"lv1_ability": "",
			"lv2_ability": "",
			"lv3_ability": ""
		},
		"summoned_from": {
			"source": "A Robin at the start of battle.",
			"url": "https://sapi.com/api/v1/pets/robin"
		},
		"stats": {
			"lv1_stats": [
				{
					"name": "hp",
					"base_stat": 3,
					"url": "https://sapi.com/api/v1/stats/hp"
				},
				{
					"name": "attack",
					"base_stat": 2,
					"url": "https://sapi.com/api/v1/stats/atk"
				}
			],
			"lv2_stats": [
				{
					"name": "hp",
					"base_stat": 6,
					"url": "https://sapi.com/api/v1/stats/hp"
				},
				{
					"name": "attack",
					"base_stat": 4,
					"url": "https://sapi.com/api/v1/stats/atk"
				}
			],
			"lv3_stats": [
				{
					"name": "hp",
					"base_stat": 9,
					"url": "https://sapi.com/api/v1/stats/hp"
				},
				{
					"name": "attack",
					"base_stat": 6,
					"url": "https://sapi.com/api/v1/stats/atk"
				}
			]
		},
		"notes": ""
	},
	{
		"name": "Ram",
		"tier_info": {
			"tier": 1,
			"url": "https://sapi.com/api/v1/tokens?tier=1"
		},
		"sprites": {
			"standard": "https://raw.githubusercontent.com/apacha01/assets/sap/super-auto-pets/tokens/standard/Ram.png",
			"classic": "https://raw.githubusercontent.com/apacha01/assets/sap/super-auto-pets/tokens/classic/Ram_Classic.png"
		},
		"abilities": {
			"lv1_ability": "",
			"lv2_ability": "",
			"lv3_ability": ""
		},
		"summoned_from": {
			"source": "A Sheep once it faints.",
			"url": "https://sapi.com/api/v1/pets/sheep"
		},
		"stats": {
			"lv1_stats": [
				{
					"name": "hp",
					"base_stat": 2,
					"url": "https://sapi.com/api/v1/stats/hp"
				},
				{
					"name": "attack",
					"base_stat": 2,
					"url": "https://sapi.com/api/v1/stats/atk"
				}
			],
			"lv2_stats": [
				{